{
  "schemaVersion": "1.0.0",
  "generatorVersion": "archspine/1.0.0",
  "createdAt": "2026-04-02T09:30:00Z",
  "updatedAt": "2026-04-02T10:00:00Z",
  "sync": {
    "lastSyncAt": "2026-04-02T10:00:00Z",
    "lastSyncMode": "full",
    "reverseIndexComplete": false,
    "indexedUnitCount": 2
  },
  "files": {
    "src/auth.ts": {
      "contentHash": "aaaaaaaaaaaaaaaaaaaaaaaaaaaaaaaaaaaaaaaaaaaaaaaaaaaaaaaaaaaaaaaa",
      "fileKind": "source",
      "lastIndexedAt": "2026-04-02T10:00:00Z",
      "docs": [],
      "sourceExists": true
    },
    "src/sync.ts": {
      "contentHash": "bbbbbbbbbbbbbbbbbbbbbbbbbbbbbbbbbbbbbbbbbbbbbbbbbbbbbbbbbbbbbbbb",
      "fileKind": "source",
      "lastIndexedAt": "2026-04-02T10:00:00Z",
      "docs": [],
      "sourceExists": true
    }
  }
}
